
*** Running vivado
    with args -log hdmi_vga_wrapper.vdi -applog -m64 -product Vivado -messageDb vivado.pb -mode batch -source hdmi_vga_wrapper.tcl -notrace


****** Vivado v2017.4 (64-bit)
  **** SW Build 2086221 on Fri Dec 15 20:55:39 MST 2017
  **** IP Build 2085800 on Fri Dec 15 22:25:07 MST 2017
    ** Copyright 1986-2017 Xilinx, Inc. All Rights Reserved.

source hdmi_vga_wrapper.tcl -notrace
INFO: [IP_Flow 19-234] Refreshing IP repositories
INFO: [IP_Flow 19-1700] Loaded user IP repository 'c:/Users/Bartek/Reconfigurable-Systems-Laboratory-Class/Lab_5/Resources/hdmi_vga_ip_repo'.
INFO: [IP_Flow 19-1700] Loaded user IP repository 'c:/Users/Bartek/Reconfigurable-Systems-Laboratory-Class/Lab_5/IPs'.
INFO: [IP_Flow 19-2313] Loaded Vivado IP repository 'C:/Xilinx/Vivado/2017.4/data/ip'.
Command: link_design -top hdmi_vga_wrapper -part xc7z010clg400-1
Design is defaulting to srcset: sources_1
Design is defaulting to constrset: constrs_1
INFO: [Project 1-454] Reading design checkpoint 'c:/Users/Bartek/Reconfigurable-Systems-Laboratory-Class/Lab_5/8_5/8_5.srcs/sources_1/bd/hdmi_vga/ip/hdmi_vga_xlconstant_0_0/hdmi_vga_xlconstant_0_0.dcp' for cell 'hdmi_vga_i/GND'
INFO: [Project 1-454] Reading design checkpoint 'c:/Users/Bartek/Reconfigurable-Systems-Laboratory-Class/Lab_5/8_5/8_5.srcs/sources_1/bd/hdmi_vga/ip/hdmi_vga_xlconstant_0_1/hdmi_vga_xlconstant_0_1.dcp' for cell 'hdmi_vga_i/VCC'
INFO: [Project 1-454] Reading design checkpoint 'c:/Users/Bartek/Reconfigurable-Systems-Laboratory-Class/Lab_5/8_5/8_5.srcs/sources_1/bd/hdmi_vga/ip/hdmi_vga_clk_wiz_0_0/hdmi_vga_clk_wiz_0_0.dcp' for cell 'hdmi_vga_i/clk_wiz_0'
INFO: [Project 1-454] Reading design checkpoint 'c:/Users/Bartek/Reconfigurable-Systems-Laboratory-Class/Lab_5/8_5/8_5.srcs/sources_1/bd/hdmi_vga/ip/hdmi_vga_dvi2rgb_0_0/hdmi_vga_dvi2rgb_0_0.dcp' for cell 'hdmi_vga_i/dvi2rgb_0'
INFO: [Project 1-454] Reading design checkpoint 'c:/Users/Bartek/Reconfigurable-Systems-Laboratory-Class/Lab_5/8_5/8_5.srcs/sources_1/bd/hdmi_vga/ip/hdmi_vga_rgb2vga_0_0/hdmi_vga_rgb2vga_0_0.dcp' for cell 'hdmi_vga_i/rgb2vga_0'
INFO: [Project 1-454] Reading design checkpoint 'c:/Users/Bartek/Reconfigurable-Systems-Laboratory-Class/Lab_5/8_5/8_5.srcs/sources_1/bd/hdmi_vga/ip/hdmi_vga_vp_bin_c_0_0/hdmi_vga_vp_bin_c_0_0.dcp' for cell 'hdmi_vga_i/vp_bin_c_0'
INFO: [Netlist 29-17] Analyzing 67 Unisim elements for replacement
INFO: [Netlist 29-28] Unisim Transformation completed in 0 CPU seconds
INFO: [Project 1-479] Netlist was created with Vivado 2017.4
INFO: [Device 21-403] Loading part xc7z010clg400-1
INFO: [Project 1-570] Preparing netlist for logic optimization
Parsing XDC File [c:/Users/Bartek/Reconfigurable-Systems-Laboratory-Class/Lab_5/8_5/8_5.srcs/sources_1/bd/hdmi_vga/ip/hdmi_vga_dvi2rgb_0_0/src/dvi2rgb.xdc] for cell 'hdmi_vga_i/dvi2rgb_0/U0'
Finished Parsing XDC File [c:/Users/Bartek/Reconfigurable-Systems-Laboratory-Class/Lab_5/8_5/8_5.srcs/sources_1/bd/hdmi_vga/ip/hdmi_vga_dvi2rgb_0_0/src/dvi2rgb.xdc] for cell 'hdmi_vga_i/dvi2rgb_0/U0'
Parsing XDC File [c:/Users/Bartek/Reconfigurable-Systems-Laboratory-Class/Lab_5/8_5/8_5.srcs/sources_1/bd/hdmi_vga/ip/hdmi_vga_clk_wiz_0_0/hdmi_vga_clk_wiz_0_0_board.xdc] for cell 'hdmi_vga_i/clk_wiz_0/inst'
Finished Parsing XDC File [c:/Users/Bartek/Reconfigurable-Systems-Laboratory-Class/Lab_5/8_5/8_5.srcs/sources_1/bd/hdmi_vga/ip/hdmi_vga_clk_wiz_0_0/hdmi_vga_clk_wiz_0_0_board.xdc] for cell 'hdmi_vga_i/clk_wiz_0/inst'
Parsing XDC File [c:/Users/Bartek/Reconfigurable-Systems-Laboratory-Class/Lab_5/8_5/8_5.srcs/sources_1/bd/hdmi_vga/ip/hdmi_vga_clk_wiz_0_0/hdmi_vga_clk_wiz_0_0.xdc] for cell 'hdmi_vga_i/clk_wiz_0/inst'
INFO: [Timing 38-35] Done setting XDC timing constraints. [c:/Users/Bartek/Reconfigurable-Systems-Laboratory-Class/Lab_5/8_5/8_5.srcs/sources_1/bd/hdmi_vga/ip/hdmi_vga_clk_wiz_0_0/hdmi_vga_clk_wiz_0_0.xdc:57]
INFO: [Timing 38-2] Deriving generated clocks [c:/Users/Bartek/Reconfigurable-Systems-Laboratory-Class/Lab_5/8_5/8_5.srcs/sources_1/bd/hdmi_vga/ip/hdmi_vga_clk_wiz_0_0/hdmi_vga_clk_wiz_0_0.xdc:57]
get_clocks: Time (s): cpu = 00:00:15 ; elapsed = 00:00:17 . Memory (MB): peak = 1158.090 ; gain = 557.145
Finished Parsing XDC File [c:/Users/Bartek/Reconfigurable-Systems-Laboratory-Class/Lab_5/8_5/8_5.srcs/sources_1/bd/hdmi_vga/ip/hdmi_vga_clk_wiz_0_0/hdmi_vga_clk_wiz_0_0.xdc] for cell 'hdmi_vga_i/clk_wiz_0/inst'
Parsing XDC File [C:/Users/Bartek/Reconfigurable-Systems-Laboratory-Class/Lab_5/8_5/8_5.srcs/constrs_1/imports/hdmi_vga_zybo_src/Zybo_HDMI.xdc]
Finished Parsing XDC File [C:/Users/Bartek/Reconfigurable-Systems-Laboratory-Class/Lab_5/8_5/8_5.srcs/constrs_1/imports/hdmi_vga_zybo_src/Zybo_HDMI.xdc]
INFO: [Opt 31-138] Pushed 0 inverter(s) to 0 load pin(s).
INFO: [Project 1-111] Unisim Transformation Summary:
  A total of 8 instances were transformed.
  IOBUF => IOBUF (IBUF, OBUFT): 2 instances
  RAM32M => RAM32M (RAMD32, RAMD32, RAMD32, RAMD32, RAMD32, RAMD32, RAMS32, RAMS32): 6 instances

19 Infos, 0 Warnings, 0 Critical Warnings and 0 Errors encountered.
link_design completed successfully
link_design: Time (s): cpu = 00:00:24 ; elapsed = 00:00:30 . Memory (MB): peak = 1158.090 ; gain = 899.172
Command: opt_design
Attempting to get a license for feature 'Implementation' and/or device 'xc7z010'
INFO: [Common 17-349] Got license for feature 'Implementation' and/or device 'xc7z010'
Running DRC as a precondition to command opt_design

Starting DRC Task
INFO: [DRC 23-27] Running DRC with 2 threads
INFO: [Project 1-461] DRC finished with 0 Errors
INFO: [Project 1-462] Please refer to the DRC report (report_drc) for more information.

Time (s): cpu = 00:00:02 ; elapsed = 00:00:02 . Memory (MB): peak = 1158.090 ; gain = 0.000
INFO: [Timing 38-35] Done setting XDC timing constraints.
INFO: [Timing 38-2] Deriving generated clocks

Starting Logic Optimization Task

Phase 1 Retarget
INFO: [Opt 31-138] Pushed 0 inverter(s) to 0 load pin(s).
INFO: [Opt 31-49] Retargeted 0 cell(s).
Phase 1 Retarget | Checksum: 140268e55

Time (s): cpu = 00:00:01 ; elapsed = 00:00:00.707 . Memory (MB): peak = 1174.164 ; gain = 0.000
INFO: [Opt 31-389] Phase Retarget created 3 cells and removed 9 cells

Phase 2 Constant propagation
INFO: [Opt 31-138] Pushed 0 inverter(s) to 0 load pin(s).
Phase 2 Constant propagation | Checksum: 140268e55

Time (s): cpu = 00:00:01 ; elapsed = 00:00:00.766 . Memory (MB): peak = 1174.164 ; gain = 0.000
INFO: [Opt 31-389] Phase Constant propagation created 0 cells and removed 0 cells

Phase 3 Sweep
Phase 3 Sweep | Checksum: 21a5b1ee7

Time (s): cpu = 00:00:01 ; elapsed = 00:00:00.955 . Memory (MB): peak = 1174.164 ; gain = 0.000
INFO: [Opt 31-389] Phase Sweep created 0 cells and removed 67 cells

Phase 4 BUFG optimization
Phase 4 BUFG optimization | Checksum: 21a5b1ee7

Time (s): cpu = 00:00:01 ; elapsed = 00:00:01 . Memory (MB): peak = 1174.164 ; gain = 0.000
INFO: [Opt 31-389] Phase BUFG optimization created 0 cells and removed 0 cells

Phase 5 Shift Register Optimization
Phase 5 Shift Register Optimization | Checksum: 21a5b1ee7

Time (s): cpu = 00:00:01 ; elapsed = 00:00:01 . Memory (MB): peak = 1174.164 ; gain = 0.000
INFO: [Opt 31-389] Phase Shift Register Optimization created 0 cells and removed 0 cells

Starting Connectivity Check Task

Time (s): cpu = 00:00:00 ; elapsed = 00:00:00.004 . Memory (MB): peak = 1174.164 ; gain = 0.000
Ending Logic Optimization Task | Checksum: 21a5b1ee7

Time (s): cpu = 00:00:01 ; elapsed = 00:00:01 . Memory (MB): peak = 1174.164 ; gain = 0.000

Starting Power Optimization Task
INFO: [Pwropt 34-132] Skipping clock gating for clocks with a period < 2.00 ns.
Ending Power Optimization Task | Checksum: 1d7efa908

Time (s): cpu = 00:00:00 ; elapsed = 00:00:00.103 . Memory (MB): peak = 1174.164 ; gain = 0.000
INFO: [Common 17-83] Releasing license: Implementation
35 Infos, 0 Warnings, 0 Critical Warnings and 0 Errors encountered.
opt_design completed successfully
Writing placer database...
Writing XDEF routing.
Writing XDEF routing logical nets.
Writing XDEF routing special nets.
Write XDEF Complete: Time (s): cpu = 00:00:00 ; elapsed = 00:00:00.184 . Memory (MB): peak = 1174.164 ; gain = 0.000
INFO: [Common 17-1381] The checkpoint 'C:/Users/Bartek/Reconfigurable-Systems-Laboratory-Class/Lab_5/8_5/8_5.runs/impl_1/hdmi_vga_wrapper_opt.dcp' has been generated.
INFO: [runtcl-4] Executing : report_drc -file hdmi_vga_wrapper_drc_opted.rpt -pb hdmi_vga_wrapper_drc_opted.pb -rpx hdmi_vga_wrapper_drc_opted.rpx
Command: report_drc -file hdmi_vga_wrapper_drc_opted.rpt -pb hdmi_vga_wrapper_drc_opted.pb -rpx hdmi_vga_wrapper_drc_opted.rpx
INFO: [IP_Flow 19-1839] IP Catalog is up to date.
INFO: [DRC 23-27] Running DRC with 2 threads
INFO: [Coretcl 2-168] The results of DRC are in file C:/Users/Bartek/Reconfigurable-Systems-Laboratory-Class/Lab_5/8_5/8_5.runs/impl_1/hdmi_vga_wrapper_drc_opted.rpt.
report_drc completed successfully
INFO: [Chipscope 16-241] No debug cores found in the current design.
Before running the implement_debug_core command, either use the Set Up Debug wizard (GUI mode)
or use the create_debug_core and connect_debug_core Tcl commands to insert debug cores into the design.
Command: place_design
Attempting to get a license for feature 'Implementation' and/or device 'xc7z010'
INFO: [Common 17-349] Got license for feature 'Implementation' and/or device 'xc7z010'
INFO: [DRC 23-27] Running DRC with 2 threads
INFO: [Vivado_Tcl 4-198] DRC finished with 0 Errors
INFO: [Vivado_Tcl 4-199] Please refer to the DRC report (report_drc) for more information.
Running DRC as a precondition to command place_design
INFO: [DRC 23-27] Running DRC with 2 threads
INFO: [Vivado_Tcl 4-198] DRC finished with 0 Errors
INFO: [Vivado_Tcl 4-199] Please refer to the DRC report (report_drc) for more information.

Starting Placer Task
INFO: [Place 30-611] Multithreading enabled for place_design using a maximum of 2 CPUs

Phase 1 Placer Initialization

Phase 1.1 Placer Initialization Netlist Sorting
Netlist sorting complete. Time (s): cpu = 00:00:00 ; elapsed = 00:00:00.006 . Memory (MB): peak = 1174.164 ; gain = 0.000
Phase 1.1 Placer Initialization Netlist Sorting | Checksum: 1181c9cb7

Time (s): cpu = 00:00:00 ; elapsed = 00:00:00.180 . Memory (MB): peak = 1174.164 ; gain = 0.000
INFO: [Timing 38-35] Done setting XDC timing constraints.
INFO: [Opt 31-138] Pushed 0 inverter(s) to 0 load pin(s).
Netlist sorting complete. Time (s): cpu = 00:00:00 ; elapsed = 00:00:00.005 . Memory (MB): peak = 1174.164 ; gain = 0.000

Phase 1.2 IO Placement/ Clock Placement/ Build Placer Device
INFO: [Timing 38-35] Done setting XDC timing constraints.
Phase 1.2 IO Placement/ Clock Placement/ Build Placer Device | Checksum: 3c555abf

Time (s): cpu = 00:00:01 ; elapsed = 00:00:02 . Memory (MB): peak = 1174.164 ; gain = 0.000

Phase 1.3 Build Placer Netlist Model
Phase 1.3 Build Placer Netlist Model | Checksum: cca57736

Time (s): cpu = 00:00:02 ; elapsed = 00:00:03 . Memory (MB): peak = 1174.164 ; gain = 0.000

Phase 1.4 Constrain Clocks/Macros
Phase 1.4 Constrain Clocks/Macros | Checksum: cca57736

Time (s): cpu = 00:00:02 ; elapsed = 00:00:03 . Memory (MB): peak = 1174.164 ; gain = 0.000
Phase 1 Placer Initialization | Checksum: cca57736

Time (s): cpu = 00:00:02 ; elapsed = 00:00:03 . Memory (MB): peak = 1174.164 ; gain = 0.000

Phase 2 Global Placement
Phase 2 Global Placement | Checksum: 9c6d8ebd

Time (s): cpu = 00:00:04 ; elapsed = 00:00:05 . Memory (MB): peak = 1174.164 ; gain = 0.000

Phase 3 Detail Placement

Phase 3.1 Commit Multi Column Macros
Phase 3.1 Commit Multi Column Macros | Checksum: 9c6d8ebd

Time (s): cpu = 00:00:04 ; elapsed = 00:00:05 . Memory (MB): peak = 1174.164 ; gain = 0.000

Phase 3.2 Commit Most Macros & LUTRAMs
Phase 3.2 Commit Most Macros & LUTRAMs | Checksum: d54afedf

Time (s): cpu = 00:00:05 ; elapsed = 00:00:05 . Memory (MB): peak = 1174.164 ; gain = 0.000

Phase 3.3 Area Swap Optimization
Phase 3.3 Area Swap Optimization | Checksum: 12afe2172

Time (s): cpu = 00:00:05 ; elapsed = 00:00:05 . Memory (MB): peak = 1174.164 ; gain = 0.000

Phase 3.4 Pipeline Register Optimization
Phase 3.4 Pipeline Register Optimization | Checksum: 13581974f

Time (s): cpu = 00:00:05 ; elapsed = 00:00:05 . Memory (MB): peak = 1174.164 ; gain = 0.000

Phase 3.5 Small Shape Detail Placement
Phase 3.5 Small Shape Detail Placement | Checksum: 13a1f2c97

Time (s): cpu = 00:00:05 ; elapsed = 00:00:06 . Memory (MB): peak = 1174.164 ; gain = 0.000

Phase 3.6 Re-assign LUT pins
Phase 3.6 Re-assign LUT pins | Checksum: ff6353b8

Time (s): cpu = 00:00:05 ; elapsed = 00:00:06 . Memory (MB): peak = 1174.164 ; gain = 0.000

Phase 3.7 Pipeline Register Optimization
Phase 3.7 Pipeline Register Optimization | Checksum: ff6353b8

Time (s): cpu = 00:00:05 ; elapsed = 00:00:06 . Memory (MB): peak = 1174.164 ; gain = 0.000
Phase 3 Detail Placement | Checksum: ff6353b8

Time (s): cpu = 00:00:05 ; elapsed = 00:00:06 . Memory (MB): peak = 1174.164 ; gain = 0.000

Phase 4 Post Placement Optimization and Clean-Up

Phase 4.1 Post Commit Optimization
INFO: [Timing 38-35] Done setting XDC timing constraints.

Phase 4.1.1 Post Placement Optimization
Post Placement Optimization Initialization | Checksum: 18eb14824

Phase 4.1.1.1 BUFG Insertion
INFO: [Physopt 32-721] Multithreading enabled for phys_opt_design using a maximum of 2 CPUs
INFO: [Place 46-31] BUFG insertion identified 0 candidate nets, 0 success, 0 skipped for placement/routing, 0 skipped for timing, 0 skipped for netlist change reason.
Phase 4.1.1.1 BUFG Insertion | Checksum: 18eb14824

Time (s): cpu = 00:00:06 ; elapsed = 00:00:07 . Memory (MB): peak = 1174.164 ; gain = 0.000
INFO: [Place 30-746] Post Placement Timing Summary WNS=1.168. For the most accurate timing information please run report_timing.
Phase 4.1.1 Post Placement Optimization | Checksum: 161228b45

Time (s): cpu = 00:00:06 ; elapsed = 00:00:07 . Memory (MB): peak = 1174.164 ; gain = 0.000
Phase 4.1 Post Commit Optimization | Checksum: 161228b45

Time (s): cpu = 00:00:06 ; elapsed = 00:00:07 . Memory (MB): peak = 1174.164 ; gain = 0.000

Phase 4.2 Post Placement Cleanup
Phase 4.2 Post Placement Cleanup | Checksum: 161228b45

Time (s): cpu = 00:00:06 ; elapsed = 00:00:07 . Memory (MB): peak = 1174.164 ; gain = 0.000

Phase 4.3 Placer Reporting
Phase 4.3 Placer Reporting | Checksum: 161228b45

Time (s): cpu = 00:00:06 ; elapsed = 00:00:07 . Memory (MB): peak = 1174.164 ; gain = 0.000

Phase 4.4 Final Placement Cleanup
Phase 4.4 Final Placement Cleanup | Checksum: 1ad0382aa

Time (s): cpu = 00:00:06 ; elapsed = 00:00:07 . Memory (MB): peak = 1174.164 ; gain = 0.000
Phase 4 Post Placement Optimization and Clean-Up | Checksum: 1ad0382aa

Time (s): cpu = 00:00:06 ; elapsed = 00:00:07 . Memory (MB): peak = 1174.164 ; gain = 0.000
Ending Placer Task | Checksum: 12308b4ad

Time (s): cpu = 00:00:06 ; elapsed = 00:00:07 . Memory (MB): peak = 1174.164 ; gain = 0.000
INFO: [Common 17-83] Releasing license: Implementation
57 Infos, 0 Warnings, 0 Critical Warnings and 0 Errors encountered.
place_design completed successfully
place_design: Time (s): cpu = 00:00:09 ; elapsed = 00:00:08 . Memory (MB): peak = 1174.164 ; gain = 0.000
Writing placer database...
Writing XDEF routing.
Writing XDEF routing logical nets.
Writing XDEF routing special nets.
Write XDEF Complete: Time (s): cpu = 00:00:00 ; elapsed = 00:00:00.219 . Memory (MB): peak = 1174.164 ; gain = 0.000
INFO: [Common 17-1381] The checkpoint 'C:/Users/Bartek/Reconfigurable-Systems-Laboratory-Class/Lab_5/8_5/8_5.runs/impl_1/hdmi_vga_wrapper_placed.dcp' has been generated.
INFO: [runtcl-4] Executing : report_io -file hdmi_vga_wrapper_io_placed.rpt
report_io: Time (s): cpu = 00:00:00 ; elapsed = 00:00:00.131 . Memory (MB): peak = 1174.164 ; gain = 0.000
INFO: [runtcl-4] Executing : report_utilization -file hdmi_vga_wrapper_utilization_placed.rpt -pb hdmi_vga_wrapper_utilization_placed.pb
report_utilization: Time (s): cpu = 00:00:00 ; elapsed = 00:00:00.045 . Memory (MB): peak = 1174.164 ; gain = 0.000
INFO: [runtcl-4] Executing : report_control_sets -verbose -file hdmi_vga_wrapper_control_sets_placed.rpt
report_control_sets: Time (s): cpu = 00:00:00 ; elapsed = 00:00:00.018 . Memory (MB): peak = 1174.164 ; gain = 0.000
Command: route_design
Attempting to get a license for feature 'Implementation' and/or device 'xc7z010'
INFO: [Common 17-349] Got license for feature 'Implementation' and/or device 'xc7z010'
Running DRC as a precondition to command route_design
INFO: [DRC 23-27] Running DRC with 2 threads
INFO: [Vivado_Tcl 4-198] DRC finished with 0 Errors
INFO: [Vivado_Tcl 4-199] Please refer to the DRC report (report_drc) for more information.


Starting Routing Task
INFO: [Route 35-254] Multithreading enabled for route_design using a maximum of 2 CPUs
Checksum: PlaceDB: b899aa7b ConstDB: 0 ShapeSum: 6a6f0a32 RouteDB: 0

Phase 1 Build RT Design
Phase 1 Build RT Design | Checksum: d4f5fef4

Time (s): cpu = 00:00:18 ; elapsed = 00:00:18 . Memory (MB): peak = 1244.504 ; gain = 70.340
Post Restoration Checksum: NetGraph: 6fb64e5 NumContArr: cdfa9a0f Constraints: 0 Timing: 0

Phase 2 Router Initialization

Phase 2.1 Create Timer
Phase 2.1 Create Timer | Checksum: d4f5fef4

Time (s): cpu = 00:00:18 ; elapsed = 00:00:19 . Memory (MB): peak = 1244.504 ; gain = 70.340

Phase 2.2 Fix Topology Constraints
Phase 2.2 Fix Topology Constraints | Checksum: d4f5fef4

Time (s): cpu = 00:00:18 ; elapsed = 00:00:20 . Memory (MB): peak = 1244.504 ; gain = 70.340

Phase 2.3 Pre Route Cleanup
Phase 2.3 Pre Route Cleanup | Checksum: d4f5fef4

Time (s): cpu = 00:00:18 ; elapsed = 00:00:20 . Memory (MB): peak = 1244.504 ; gain = 70.340
 Number of Nodes with overlaps = 0

Phase 2.4 Update Timing
Phase 2.4 Update Timing | Checksum: 1b2d1197b

Time (s): cpu = 00:00:19 ; elapsed = 00:00:21 . Memory (MB): peak = 1244.504 ; gain = 70.340
INFO: [Route 35-416] Intermediate Timing Summary | WNS=1.204  | TNS=0.000  | WHS=-0.562 | THS=-13.185|

Phase 2 Router Initialization | Checksum: 180ac4732

Time (s): cpu = 00:00:19 ; elapsed = 00:00:21 . Memory (MB): peak = 1244.504 ; gain = 70.340

Phase 3 Initial Routing
Phase 3 Initial Routing | Checksum: 19335da04

Time (s): cpu = 00:00:20 ; elapsed = 00:00:21 . Memory (MB): peak = 1244.504 ; gain = 70.340

Phase 4 Rip-up And Reroute

Phase 4.1 Global Iteration 0
 Number of Nodes with overlaps = 97
 Number of Nodes with overlaps = 9
 Number of Nodes with overlaps = 1
 Number of Nodes with overlaps = 0
INFO: [Route 35-416] Intermediate Timing Summary | WNS=1.028  | TNS=0.000  | WHS=N/A    | THS=N/A    |

Phase 4.1 Global Iteration 0 | Checksum: e3bbb34c

Time (s): cpu = 00:00:20 ; elapsed = 00:00:22 . Memory (MB): peak = 1244.504 ; gain = 70.340
Phase 4 Rip-up And Reroute | Checksum: e3bbb34c

Time (s): cpu = 00:00:20 ; elapsed = 00:00:22 . Memory (MB): peak = 1244.504 ; gain = 70.340

Phase 5 Delay and Skew Optimization

Phase 5.1 Delay CleanUp
Phase 5.1 Delay CleanUp | Checksum: e3bbb34c

Time (s): cpu = 00:00:20 ; elapsed = 00:00:22 . Memory (MB): peak = 1244.504 ; gain = 70.340

Phase 5.2 Clock Skew Optimization
Phase 5.2 Clock Skew Optimization | Checksum: e3bbb34c

Time (s): cpu = 00:00:20 ; elapsed = 00:00:22 . Memory (MB): peak = 1244.504 ; gain = 70.340
Phase 5 Delay and Skew Optimization | Checksum: e3bbb34c

Time (s): cpu = 00:00:20 ; elapsed = 00:00:22 . Memory (MB): peak = 1244.504 ; gain = 70.340

Phase 6 Post Hold Fix

Phase 6.1 Hold Fix Iter

Phase 6.1.1 Update Timing
Phase 6.1.1 Update Timing | Checksum: ba8f4ba7

Time (s): cpu = 00:00:21 ; elapsed = 00:00:22 . Memory (MB): peak = 1244.504 ; gain = 70.340
INFO: [Route 35-416] Intermediate Timing Summary | WNS=1.143  | TNS=0.000  | WHS=0.029  | THS=0.000  |

Phase 6.1 Hold Fix Iter | Checksum: 27e514ad

Time (s): cpu = 00:00:21 ; elapsed = 00:00:22 . Memory (MB): peak = 1244.504 ; gain = 70.340
Phase 6 Post Hold Fix | Checksum: 27e514ad

Time (s): cpu = 00:00:21 ; elapsed = 00:00:22 . Memory (MB): peak = 1244.504 ; gain = 70.340

Phase 7 Route finalize

Router Utilization Summary
  Global Vertical Routing Utilization    = 0.249015 %
  Global Horizontal Routing Utilization  = 0.253906 %
  Routable Net Status*
  *Does not include unroutable nets such as driverless and loadless.
  Run report_route_status for detailed report.
  Number of Failed Nets               = 0
  Number of Unrouted Nets             = 0
  Number of Partially Routed Nets     = 0
  Number of Node Overlaps             = 0

Phase 7 Route finalize | Checksum: 4886d6a6

Time (s): cpu = 00:00:21 ; elapsed = 00:00:22 . Memory (MB): peak = 1244.504 ; gain = 70.340

Phase 8 Verifying routed nets

 Verification completed successfully
Phase 8 Verifying routed nets | Checksum: 4886d6a6

Time (s): cpu = 00:00:21 ; elapsed = 00:00:22 . Memory (MB): peak = 1244.504 ; gain = 70.340

Phase 9 Depositing Routes
Phase 9 Depositing Routes | Checksum: f1d09db6

Time (s): cpu = 00:00:21 ; elapsed = 00:00:22 . Memory (MB): peak = 1244.504 ; gain = 70.340

Phase 10 Post Router Timing
INFO: [Route 35-57] Estimated Timing Summary | WNS=1.143  | TNS=0.000  | WHS=0.029  | THS=0.000  |

INFO: [Route 35-327] The final timing numbers are based on the router estimated timing analysis. For a complete and accurate timing signoff, please run report_timing_summary.
Phase 10 Post Router Timing | Checksum: f1d09db6

Time (s): cpu = 00:00:21 ; elapsed = 00:00:22 . Memory (MB): peak = 1244.504 ; gain = 70.340
INFO: [Route 35-16] Router Completed Successfully

Time (s): cpu = 00:00:21 ; elapsed = 00:00:22 . Memory (MB): peak = 1244.504 ; gain = 70.340

Routing Is Done.
INFO: [Common 17-83] Releasing license: Implementation
73 Infos, 0 Warnings, 0 Critical Warnings and 0 Errors encountered.
route_design completed successfully
route_design: Time (s): cpu = 00:00:24 ; elapsed = 00:00:24 . Memory (MB): peak = 1244.504 ; gain = 70.340
Writing placer database...
Writing XDEF routing.
Writing XDEF routing logical nets.
Writing XDEF routing special nets.
Write XDEF Complete: Time (s): cpu = 00:00:00 ; elapsed = 00:00:00.250 . Memory (MB): peak = 1244.504 ; gain = 0.000
INFO: [Common 17-1381] The checkpoint 'C:/Users/Bartek/Reconfigurable-Systems-Laboratory-Class/Lab_5/8_5/8_5.runs/impl_1/hdmi_vga_wrapper_routed.dcp' has been generated.
INFO: [runtcl-4] Executing : report_drc -file hdmi_vga_wrapper_drc_routed.rpt -pb hdmi_vga_wrapper_drc_routed.pb -rpx hdmi_vga_wrapper_drc_routed.rpx
Command: report_drc -file hdmi_vga_wrapper_drc_routed.rpt -pb hdmi_vga_wrapper_drc_routed.pb -rpx hdmi_vga_wrapper_drc_routed.rpx
INFO: [IP_Flow 19-1839] IP Catalog is up to date.
INFO: [DRC 23-27] Running DRC with 2 threads
INFO: [Coretcl 2-168] The results of DRC are in file C:/Users/Bartek/Reconfigurable-Systems-Laboratory-Class/Lab_5/8_5/8_5.runs/impl_1/hdmi_vga_wrapper_drc_routed.rpt.
report_drc completed successfully
INFO: [runtcl-4] Executing : report_methodology -file hdmi_vga_wrapper_methodology_drc_routed.rpt -pb hdmi_vga_wrapper_methodology_drc_routed.pb -rpx hdmi_vga_wrapper_methodology_drc_routed.rpx
Command: report_methodology -file hdmi_vga_wrapper_methodology_drc_routed.rpt -pb hdmi_vga_wrapper_methodology_drc_routed.pb -rpx hdmi_vga_wrapper_methodology_drc_routed.rpx
INFO: [Timing 38-35] Done setting XDC timing constraints.
INFO: [Timing 38-35] Done setting XDC timing constraints.
INFO: [DRC 23-133] Running Methodology with 2 threads
INFO: [Coretcl 2-1520] The results of Report Methodology are in file C:/Users/Bartek/Reconfigurable-Systems-Laboratory-Class/Lab_5/8_5/8_5.runs/impl_1/hdmi_vga_wrapper_methodology_drc_routed.rpt.
report_methodology completed successfully
INFO: [runtcl-4] Executing : report_power -file hdmi_vga_wrapper_power_routed.rpt -pb hdmi_vga_wrapper_power_summary_routed.pb -rpx hdmi_vga_wrapper_power_routed.rpx
Command: report_power -file hdmi_vga_wrapper_power_routed.rpt -pb hdmi_vga_wrapper_power_summary_routed.pb -rpx hdmi_vga_wrapper_power_routed.rpx
INFO: [Timing 38-35] Done setting XDC timing constraints.
Running Vector-less Activity Propagation...

Finished Running Vector-less Activity Propagation
85 Infos, 0 Warnings, 0 Critical Warnings and 0 Errors encountered.
report_power completed successfully
INFO: [runtcl-4] Executing : report_route_status -file hdmi_vga_wrapper_route_status.rpt -pb hdmi_vga_wrapper_route_status.pb
INFO: [runtcl-4] Executing : report_timing_summary -max_paths 10 -file hdmi_vga_wrapper_timing_summary_routed.rpt -rpx hdmi_vga_wrapper_timing_summary_routed.rpx -warn_on_violation 
INFO: [Timing 38-91] UpdateTimingParams: Speed grade: -1, Delay Type: min_max.
INFO: [Timing 38-191] Multithreading enabled for timing update using a maximum of 2 CPUs
INFO: [runtcl-4] Executing : report_incremental_reuse -file hdmi_vga_wrapper_incremental_reuse_routed.rpt
INFO: [Vivado_Tcl 4-545] No incremental reuse to report, no incremental placement and routing data was found.
INFO: [runtcl-4] Executing : report_clock_utilization -file hdmi_vga_wrapper_clock_utilization_routed.rpt
INFO: [Common 17-206] Exiting Vivado at Tue May  1 09:44:10 2018...

*** Running vivado
    with args -log hdmi_vga_wrapper.vdi -applog -m64 -product Vivado -messageDb vivado.pb -mode batch -source hdmi_vga_wrapper.tcl -notrace


****** Vivado v2017.4 (64-bit)
  **** SW Build 2086221 on Fri Dec 15 20:55:39 MST 2017
  **** IP Build 2085800 on Fri Dec 15 22:25:07 MST 2017
    ** Copyright 1986-2017 Xilinx, Inc. All Rights Reserved.

source hdmi_vga_wrapper.tcl -notrace
Command: open_checkpoint hdmi_vga_wrapper_routed.dcp

Starting open_checkpoint Task

Time (s): cpu = 00:00:00 ; elapsed = 00:00:00.083 . Memory (MB): peak = 227.969 ; gain = 0.000
INFO: [Netlist 29-17] Analyzing 67 Unisim elements for replacement
INFO: [Netlist 29-28] Unisim Transformation completed in 0 CPU seconds
INFO: [Project 1-479] Netlist was created with Vivado 2017.4
INFO: [Device 21-403] Loading part xc7z010clg400-1
INFO: [Project 1-570] Preparing netlist for logic optimization
Parsing XDC File [C:/Users/Bartek/Reconfigurable-Systems-Laboratory-Class/Lab_5/8_5/8_5.runs/impl_1/.Xil/Vivado-6184-DESKTOP-35S9QF6/dcp1/hdmi_vga_wrapper_board.xdc]
Finished Parsing XDC File [C:/Users/Bartek/Reconfigurable-Systems-Laboratory-Class/Lab_5/8_5/8_5.runs/impl_1/.Xil/Vivado-6184-DESKTOP-35S9QF6/dcp1/hdmi_vga_wrapper_board.xdc]
Parsing XDC File [C:/Users/Bartek/Reconfigurable-Systems-Laboratory-Class/Lab_5/8_5/8_5.runs/impl_1/.Xil/Vivado-6184-DESKTOP-35S9QF6/dcp1/hdmi_vga_wrapper_early.xdc]
INFO: [Timing 38-35] Done setting XDC timing constraints. [C:/Users/Bartek/Reconfigurable-Systems-Laboratory-Class/Lab_5/8_5/8_5.srcs/sources_1/bd/hdmi_vga/ip/hdmi_vga_clk_wiz_0_0/hdmi_vga_clk_wiz_0_0.xdc:57]
INFO: [Timing 38-2] Deriving generated clocks [C:/Users/Bartek/Reconfigurable-Systems-Laboratory-Class/Lab_5/8_5/8_5.srcs/sources_1/bd/hdmi_vga/ip/hdmi_vga_clk_wiz_0_0/hdmi_vga_clk_wiz_0_0.xdc:57]
get_clocks: Time (s): cpu = 00:00:15 ; elapsed = 00:00:16 . Memory (MB): peak = 1134.000 ; gain = 558.656
Finished Parsing XDC File [C:/Users/Bartek/Reconfigurable-Systems-Laboratory-Class/Lab_5/8_5/8_5.runs/impl_1/.Xil/Vivado-6184-DESKTOP-35S9QF6/dcp1/hdmi_vga_wrapper_early.xdc]
Parsing XDC File [C:/Users/Bartek/Reconfigurable-Systems-Laboratory-Class/Lab_5/8_5/8_5.runs/impl_1/.Xil/Vivado-6184-DESKTOP-35S9QF6/dcp1/hdmi_vga_wrapper.xdc]
Finished Parsing XDC File [C:/Users/Bartek/Reconfigurable-Systems-Laboratory-Class/Lab_5/8_5/8_5.runs/impl_1/.Xil/Vivado-6184-DESKTOP-35S9QF6/dcp1/hdmi_vga_wrapper.xdc]
Reading XDEF placement.
Reading placer database...
Reading XDEF routing.
Read XDEF File: Time (s): cpu = 00:00:00 ; elapsed = 00:00:00.343 . Memory (MB): peak = 1134.273 ; gain = 0.273
Restored from archive | CPU: 0.000000 secs | Memory: 0.000000 MB |
Finished XDEF File Restore: Time (s): cpu = 00:00:00 ; elapsed = 00:00:00.343 . Memory (MB): peak = 1134.273 ; gain = 0.273
INFO: [Project 1-111] Unisim Transformation Summary:
  A total of 8 instances were transformed.
  IOBUF => IOBUF (IBUF, OBUFT): 2 instances
  RAM32M => RAM32M (RAMD32, RAMD32, RAMD32, RAMD32, RAMD32, RAMD32, RAMS32, RAMS32): 6 instances

INFO: [Project 1-604] Checkpoint was created with Vivado v2017.4 (64-bit) build 2086221
open_checkpoint: Time (s): cpu = 00:00:24 ; elapsed = 00:00:31 . Memory (MB): peak = 1134.480 ; gain = 907.824
Command: write_bitstream -force hdmi_vga_wrapper.bit
Attempting to get a license for feature 'Implementation' and/or device 'xc7z010'
INFO: [Common 17-349] Got license for feature 'Implementation' and/or device 'xc7z010'
Running DRC as a precondition to command write_bitstream
INFO: [IP_Flow 19-234] Refreshing IP repositories
INFO: [IP_Flow 19-1704] No user IP repositories specified
INFO: [IP_Flow 19-2313] Loaded Vivado IP repository 'C:/Xilinx/Vivado/2017.4/data/ip'.
INFO: [DRC 23-27] Running DRC with 2 threads
WARNING: [DRC ZPS7-1] PS7 block required: The PS7 cell must be used in this Zynq design in order to enable correct default configuration.
INFO: [Vivado 12-3199] DRC finished with 0 Errors, 1 Warnings
INFO: [Vivado 12-3200] Please refer to the DRC report (report_drc) for more information.
INFO: [Project 1-821] Please set project.enableDesignId to be 'true'.
INFO: [Designutils 20-2272] Running write_bitstream with 2 threads.
Loading data files...
Loading site data...
Loading route data...
Processing options...
Creating bitmap...
Creating bitstream...
Writing bitstream ./hdmi_vga_wrapper.bit...
INFO: [Vivado 12-1842] Bitgen Completed Successfully.
INFO: [Project 1-120] WebTalk data collection is mandatory when using a WebPACK part without a full Vivado license. To see the specific WebTalk data collected for your design, open the usage_statistics_webtalk.html or usage_statistics_webtalk.xml file in the implementation directory.
INFO: [Common 17-186] 'C:/Users/Bartek/Reconfigurable-Systems-Laboratory-Class/Lab_5/8_5/8_5.runs/impl_1/usage_statistics_webtalk.xml' has been successfully sent to Xilinx on Tue May  1 10:07:37 2018. For additional details about this file, please refer to the WebTalk help file at C:/Xilinx/Vivado/2017.4/doc/webtalk_introduction.html.
INFO: [Common 17-83] Releasing license: Implementation
22 Infos, 1 Warnings, 0 Critical Warnings and 0 Errors encountered.
write_bitstream completed successfully
write_bitstream: Time (s): cpu = 00:00:19 ; elapsed = 00:00:23 . Memory (MB): peak = 1590.699 ; gain = 456.219
INFO: [Common 17-206] Exiting Vivado at Tue May  1 10:07:37 2018...
